{
  "id": "a13f0c2b91e4",
  "severity": "major",
  "criterion": "no-plaintext-secrets",
  "location": {
    "file": "src/http/auth.ts",
    "line": 12,
    "endLine": 40,
    "blobSha": "3f5b1c9d7e204a8b6c1d0e2f3a4b5c6d7e8f9012"
  },
  "message": "the refresh token is stored in localStorage, which any XSS can read",
  "evidence": ["file://src/http/auth.ts#L12-L40"],
  "suggestedFix": "move the refresh token to an httpOnly cookie"
}
